approved,timestamp,id,name,type,category,sub-category,lat,lng,short_description,description,months,image,tags,likes,dislikes,reports,comments,what_three_words,season,plus_code,link,address,town,area,county,postcode
True,,1,Backhouse Park Community Orchard,Community Orchard,fruits,tree-fruits,54.898,-1.378,Community orchard within a historic parkland featuring various apple and pe...,Community orchard within a historic parkland featuring various apple and pear varieties open for public harvesting.,,https://images.unsplash.com/photo-1542273917363-3b1817f69a2d?w=512&q=80,,,,,,,8;9;10,,"http://maps.google.com/?q=54.898,-1.378",Sunderland,Sunderland,Sunderland,Tyne and Wear,SR2 7SU
True,,2,Incredible Edible Sunderland (City Centre),Urban Foraging,vegetables,street-planters,54.906,-1.382,Active community planters in the city centre area featuring free-to-pick he...,Active community planters in the city centre area featuring free-to-pick herbs and seasonal vegetables.,,https://images.unsplash.com/photo-1542273917363-3b1817f69a2d?w=512&q=80,,,,,,,8;9;10,,"http://maps.google.com/?q=54.906,-1.382",Sunderland,Sunderland,Sunderland,Tyne and Wear,SR1 3AA
True,,3,Roker Coast Foraging,Coastal Foraging,wild,coastal,54.922,-1.365,"Rocky shoreline offering sea beet, scurvy grass, and various edible seaweed...","Rocky shoreline offering sea beet, scurvy grass, and various edible seaweeds like dulse and kelp.",,https://images.unsplash.com/photo-1542273917363-3b1817f69a2d?w=512&q=80,,,,,,,8;9;10,,"http://maps.google.com/?q=54.922,-1.365",Roker,Roker,Roker,Tyne and Wear,SR6 0PL
True,,4,Mowbray Park Fruit Edges,Public Park,fruits,tree-fruits,54.903,-1.375,Victorian park with various fruit trees and brambles along the peripheral p...,Victorian park with various fruit trees and brambles along the peripheral paths.,,https://images.unsplash.com/photo-1542273917363-3b1817f69a2d?w=512&q=80,,,,,,,8;9;10,,"http://maps.google.com/?q=54.903,-1.375",Sunderland,Sunderland,Sunderland,Tyne and Wear,SR1 3PP
True,,5,Barnes Park Foraging Edges,Public Park,wild,mixed-forage,54.892,-1.405,"Large urban park with boundary paths offering elderberries, blackberries, a...","Large urban park with boundary paths offering elderberries, blackberries, and wild garlic (spring).",,https://images.unsplash.com/photo-1542273917363-3b1817f69a2d?w=512&q=80,,,,,,,8;9;10,,"http://maps.google.com/?q=54.892,-1.405",Sunderland,Sunderland,Sunderland,Tyne and Wear,SR4 7PX
True,,6,Herrington Country Park Foraging,Nature Reserve,wild,mixed-forage,54.885,-1.465,"Vast green space with abundant elderberries, blackberries, and rosehips alo...","Vast green space with abundant elderberries, blackberries, and rosehips along the trail network.",,https://images.unsplash.com/photo-1542273917363-3b1817f69a2d?w=512&q=80,,,,,,,8;9;10,,"http://maps.google.com/?q=54.885,-1.465",Sunderland,Sunderland,Sunderland,Tyne and Wear,DH4 7EL
True,,7,Incredible Edible Sunderland (Southwick),Urban Foraging,vegetables,street-planters,54.918,-1.412,Community growing spots in the Southwick area providing free herbs and gree...,Community growing spots in the Southwick area providing free herbs and greens for local residents.,,https://images.unsplash.com/photo-1542273917363-3b1817f69a2d?w=512&q=80,,,,,,,8;9;10,,"http://maps.google.com/?q=54.918,-1.412",Sunderland,Sunderland,Sunderland,Tyne and Wear,SR5 2AB
True,,8,River Wear Path Foraging,Public Path,wild,river-forage,54.915,-1.435,Riverside trail offering wild garlic in spring and plenty of brambles for b...,Riverside trail offering wild garlic in spring and plenty of brambles for blackberry picking in autumn.,,https://images.unsplash.com/photo-1542273917363-3b1817f69a2d?w=512&q=80,,,,,,,8;9;10,,"http://maps.google.com/?q=54.915,-1.435",Sunderland,Sunderland,Sunderland,Tyne and Wear,SR4 6RQ
True,,9,Tunstall Hills Nature Reserve,Nature Reserve,wild,mixed-forage,54.878,-1.385,Limestone grassland and scrub area known for its heavy crops of blackberrie...,Limestone grassland and scrub area known for its heavy crops of blackberries and sloes.,,https://images.unsplash.com/photo-1542273917363-3b1817f69a2d?w=512&q=80,,,,,,,8;9;10,,"http://maps.google.com/?q=54.878,-1.385",Sunderland,Sunderland,Sunderland,Tyne and Wear,SR2 9NX
True,,10,Incredible Edible Sunderland (Hendon),Urban Foraging,vegetables,street-planters,54.895,-1.365,Raised beds and planters near the Hendon community area featuring culinary ...,Raised beds and planters near the Hendon community area featuring culinary herbs and seasonal greens.,,https://images.unsplash.com/photo-1542273917363-3b1817f69a2d?w=512&q=80,,,,,,,8;9;10,,"http://maps.google.com/?q=54.895,-1.365",Sunderland,Sunderland,Sunderland,Tyne and Wear,SR1 2NZ
True,,11,Silksworth Sports Complex Wild Edges,Public Park,wild,mixed-forage,54.872,-1.418,Peripheral paths with fruit-bearing bushes and elder trees integrated into ...,Peripheral paths with fruit-bearing bushes and elder trees integrated into the landscaping.,,https://images.unsplash.com/photo-1542273917363-3b1817f69a2d?w=512&q=80,,,,,,,8;9;10,,"http://maps.google.com/?q=54.872,-1.418",Sunderland,Sunderland,Sunderland,Tyne and Wear,SR3 1PD
True,,12,Rainton Meadows Nature Reserve,Nature Reserve,wild,mixed-forage,54.848,-1.492,"Wetland and scrub area offering sloes, elderberries, and blackberries in ab...","Wetland and scrub area offering sloes, elderberries, and blackberries in abundance.",,https://images.unsplash.com/photo-1542273917363-3b1817f69a2d?w=512&q=80,,,,,,,8;9;10,,"http://maps.google.com/?q=54.848,-1.492",Sunderland,Sunderland,Sunderland,Tyne and Wear,DH4 6PU
True,,13,Incredible Edible Sunderland (Washington),Urban Foraging,vegetables,street-planters,54.902,-1.522,Public planters in the Washington town area providing free herbs and edible...,Public planters in the Washington town area providing free herbs and edible plants.,,https://images.unsplash.com/photo-1542273917363-3b1817f69a2d?w=512&q=80,,,,,,,8;9;10,,"http://maps.google.com/?q=54.902,-1.522",Washington,Washington,Washington,Tyne and Wear,NE38 7AY
True,,14,James Steel Park Foraging,Public Park,wild,mixed-forage,54.892,-1.535,Parkland with wooded edges providing hazelnuts and late summer berries.,Parkland with wooded edges providing hazelnuts and late summer berries.,,https://images.unsplash.com/photo-1542273917363-3b1817f69a2d?w=512&q=80,,,,,,,8;9;10,,"http://maps.google.com/?q=54.892,-1.535",Washington,Washington,Washington,Tyne and Wear,NE38 0AD
True,,15,Coastal Foraging (Whitburn Steel),Coastal Foraging,wild,coastal,54.945,-1.355,"Rocky shoreline and dunes offering sea beet, sea kale, and various edible s...","Rocky shoreline and dunes offering sea beet, sea kale, and various edible seaweeds.",,https://images.unsplash.com/photo-1542273917363-3b1817f69a2d?w=512&q=80,,,,,,,8;9;10,,"http://maps.google.com/?q=54.945,-1.355",Whitburn,Whitburn,Whitburn,Tyne and Wear,SR6 7BP
