approved,timestamp,id,name,type,category,sub-category,lat,lng,short_description,description,months,image,tags,likes,dislikes,reports,comments,what_three_words,season,plus_code,link,address,town,area,county,postcode
True,,1,Newcastle Community Orchard,Community Orchard,fruits,tree-fruits,54.982,-1.642,Located at Nuns Moor Park. A large community-managed orchard with heritage ...,Located at Nuns Moor Park. A large community-managed orchard with heritage apple and pear trees.,,https://images.unsplash.com/photo-1560493676-04071c5f467b?w=512&q=80,,,,,,,8;9;10,,"https://images.unsplash.com/photo-1560493676-04071c5f467b?w=512&q=80,,,,,,,8;9;10,,https://www.google.com/maps/search/?api=1&query=No+Man's+Community+Orchard,Chartham054.982,-1.642",Newcastle,Newcastle,Newcastle,Tyne and Wear,NE4 9RT
True,,2,Incredible Edible Newcastle,Urban Foraging,vegetables,street-planters,54.975,-1.605,"Community planters at the Ouseburn and Shieldfield with free herbs, vegetab...","Community planters at the Ouseburn and Shieldfield with free herbs, vegetables, and fruit bushes.",,https://images.unsplash.com/photo-1560493676-04071c5f467b?w=512&q=80,,,,,,,8;9;10,,"https://images.unsplash.com/photo-1560493676-04071c5f467b?w=512&q=80,,,,,,,8;9;10,,https://www.google.com/maps/search/?api=1&query=No+Man's+Community+Orchard,Chartham054.975,-1.605",Newcastle,Newcastle,Newcastle,Tyne and Wear,NE1 2JW
True,,3,Tynemouth Coastal Path Foraging,Coastal Foraging,wild,coastal,55.018,-1.415,"Coastal cliffs offering sea beet, rock samphire, and wild radish along the ...","Coastal cliffs offering sea beet, rock samphire, and wild radish along the clifftops.",,https://images.unsplash.com/photo-1560493676-04071c5f467b?w=512&q=80,,,,,,,8;9;10,,"https://images.unsplash.com/photo-1560493676-04071c5f467b?w=512&q=80,,,,,,,8;9;10,,https://www.google.com/maps/search/?api=1&query=No+Man's+Community+Orchard,Chartham055.018,-1.415",Tynemouth,Tynemouth,Tynemouth,Tyne and Wear,NE30 4BY
True,,4,Sunderland Community Orchard,Community Orchard,fruits,tree-fruits,54.895,-1.372,Located at Mowbray Park. Features traditional fruit trees for public harves...,Located at Mowbray Park. Features traditional fruit trees for public harvesting in late summer.,,https://images.unsplash.com/photo-1560493676-04071c5f467b?w=512&q=80,,,,,,,8;9;10,,"https://images.unsplash.com/photo-1560493676-04071c5f467b?w=512&q=80,,,,,,,8;9;10,,https://www.google.com/maps/search/?api=1&query=No+Man's+Community+Orchard,Chartham054.895,-1.372",Sunderland,Sunderland,Sunderland,Tyne and Wear,SR2 7EE
True,,5,Incredible Edible Sunderland,Urban Foraging,vegetables,street-planters,54.905,-1.382,Public planters in the town center and Sunniside featuring free herbs and s...,Public planters in the town center and Sunniside featuring free herbs and seasonal greens.,,https://images.unsplash.com/photo-1560493676-04071c5f467b?w=512&q=80,,,,,,,8;9;10,,"https://images.unsplash.com/photo-1560493676-04071c5f467b?w=512&q=80,,,,,,,8;9;10,,https://www.google.com/maps/search/?api=1&query=No+Man's+Community+Orchard,Chartham054.905,-1.382",Sunderland,Sunderland,Sunderland,Tyne and Wear,SR1 1PP
True,,6,Jesmond Dene Foraging,Woodland,nuts,woodland,54.992,-1.595,"Wooded valley known for hazelnuts, sweet chestnuts, and wild garlic in spri...","Wooded valley known for hazelnuts, sweet chestnuts, and wild garlic in spring.",,https://images.unsplash.com/photo-1560493676-04071c5f467b?w=512&q=80,,,,,,,8;9;10,,"https://images.unsplash.com/photo-1560493676-04071c5f467b?w=512&q=80,,,,,,,8;9;10,,https://www.google.com/maps/search/?api=1&query=No+Man's+Community+Orchard,Chartham054.992,-1.595",Newcastle,Newcastle,Newcastle,Tyne and Wear,NE7 7DA
True,,7,Gateshead Community Orchard,Community Orchard,fruits,tree-fruits,54.952,-1.602,Located at Saltwell Park. Historic orchard space with heritage northern app...,Located at Saltwell Park. Historic orchard space with heritage northern apple varieties.,,https://images.unsplash.com/photo-1560493676-04071c5f467b?w=512&q=80,,,,,,,8;9;10,,"https://images.unsplash.com/photo-1560493676-04071c5f467b?w=512&q=80,,,,,,,8;9;10,,https://www.google.com/maps/search/?api=1&query=No+Man's+Community+Orchard,Chartham054.952,-1.602",Gateshead,Gateshead,Gateshead,Tyne and Wear,NE8 4XW
True,,8,Incredible Edible Gateshead,Urban Foraging,vegetables,street-planters,54.962,-1.605,Community planters at the civic center and Trinity Square with free herbs a...,Community planters at the civic center and Trinity Square with free herbs and veg.,,https://images.unsplash.com/photo-1560493676-04071c5f467b?w=512&q=80,,,,,,,8;9;10,,"https://images.unsplash.com/photo-1560493676-04071c5f467b?w=512&q=80,,,,,,,8;9;10,,https://www.google.com/maps/search/?api=1&query=No+Man's+Community+Orchard,Chartham054.962,-1.605",Gateshead,Gateshead,Gateshead,Tyne and Wear,NE8 1AF
True,,9,South Shields Coastal Path,Coastal Foraging,wild,coastal,54.988,-1.415,"Leas and coastal cliffs offering sea buckthorn (autumn), sea beet, and wild...","Leas and coastal cliffs offering sea buckthorn (autumn), sea beet, and wild mustard.",,https://images.unsplash.com/photo-1560493676-04071c5f467b?w=512&q=80,,,,,,,8;9;10,,"https://images.unsplash.com/photo-1560493676-04071c5f467b?w=512&q=80,,,,,,,8;9;10,,https://www.google.com/maps/search/?api=1&query=No+Man's+Community+Orchard,Chartham054.988,-1.415",South Shields,South Shields,South Shields,Tyne and Wear,NE33 2LA
True,,10,Gosforth Central Park Orchard,Community Orchard,fruits,tree-fruits,55.002,-1.625,Small urban orchard space managed for local fruit harvesting.,Small urban orchard space managed for local fruit harvesting.,,https://images.unsplash.com/photo-1560493676-04071c5f467b?w=512&q=80,,,,,,,8;9;10,,"https://images.unsplash.com/photo-1560493676-04071c5f467b?w=512&q=80,,,,,,,8;9;10,,https://www.google.com/maps/search/?api=1&query=No+Man's+Community+Orchard,Chartham055.002,-1.625",Newcastle,Newcastle,Newcastle,Tyne and Wear,NE3 1AA
True,,11,Hebburn Community Orchard,Community Orchard,fruits,tree-fruits,54.965,-1.512,Located at Hebburn Riverside Park. Features various fruit trees for public ...,Located at Hebburn Riverside Park. Features various fruit trees for public use.,,https://images.unsplash.com/photo-1560493676-04071c5f467b?w=512&q=80,,,,,,,8;9;10,,"https://images.unsplash.com/photo-1560493676-04071c5f467b?w=512&q=80,,,,,,,8;9;10,,https://www.google.com/maps/search/?api=1&query=No+Man's+Community+Orchard,Chartham054.965,-1.512",Hebburn,Hebburn,Hebburn,Tyne and Wear,NE31 2SW
True,,12,Incredible Edible North Shields,Urban Foraging,vegetables,street-planters,55.008,-1.442,Public planters near the Fish Quay with free herbs and seasonal greens.,Public planters near the Fish Quay with free herbs and seasonal greens.,,https://images.unsplash.com/photo-1560493676-04071c5f467b?w=512&q=80,,,,,,,8;9;10,,"https://images.unsplash.com/photo-1560493676-04071c5f467b?w=512&q=80,,,,,,,8;9;10,,https://www.google.com/maps/search/?api=1&query=No+Man's+Community+Orchard,Chartham055.008,-1.442",North Shields,North Shields,North Shields,Tyne and Wear,NE30 1AA
True,,13,Whitley Bay Coastal Edges,Coastal Foraging,wild,coastal,55.045,-1.442,Clifftop trails offering rock samphire and sea beet near St Mary's Lighthou...,Clifftop trails offering rock samphire and sea beet near St Mary's Lighthouse.,,https://images.unsplash.com/photo-1560493676-04071c5f467b?w=512&q=80,,,,,,,8;9;10,,"https://images.unsplash.com/photo-1560493676-04071c5f467b?w=512&q=80,,,,,,,8;9;10,,https://www.google.com/maps/search/?api=1&query=No+Man's+Community+Orchard,Chartham055.045,-1.442",Whitley Bay,Whitley Bay,Whitley Bay,Tyne and Wear,NE26 1EJ
True,,14,Killingworth Lake Foraging,Public Park,wild,mixed-forage,55.035,-1.562,"Lakeside paths with abundant elderberries, blackberries, and sloes.","Lakeside paths with abundant elderberries, blackberries, and sloes.",,https://images.unsplash.com/photo-1560493676-04071c5f467b?w=512&q=80,,,,,,,8;9;10,,"https://images.unsplash.com/photo-1560493676-04071c5f467b?w=512&q=80,,,,,,,8;9;10,,https://www.google.com/maps/search/?api=1&query=No+Man's+Community+Orchard,Chartham055.035,-1.562",Killingworth,Killingworth,Killingworth,Tyne and Wear,NE12 6HS
True,,15,Jarrow Community Orchard,Community Orchard,fruits,tree-fruits,54.975,-1.488,Located at Drewett's Park. Small orchard project for local harvesting.,Located at Drewett's Park. Small orchard project for local harvesting.,,https://images.unsplash.com/photo-1560493676-04071c5f467b?w=512&q=80,,,,,,,8;9;10,,"https://images.unsplash.com/photo-1560493676-04071c5f467b?w=512&q=80,,,,,,,8;9;10,,https://www.google.com/maps/search/?api=1&query=No+Man's+Community+Orchard,Chartham054.975,-1.488",Jarrow,Jarrow,Jarrow,Tyne and Wear,NE32 3QY
True,,16,Incredible Edible South Shields,Urban Foraging,vegetables,street-planters,54.995,-1.432,Community planters at the marketplace and seafront with herbs and veg.,Community planters at the marketplace and seafront with herbs and veg.,,https://images.unsplash.com/photo-1560493676-04071c5f467b?w=512&q=80,,,,,,,8;9;10,,"https://images.unsplash.com/photo-1560493676-04071c5f467b?w=512&q=80,,,,,,,8;9;10,,https://www.google.com/maps/search/?api=1&query=No+Man's+Community+Orchard,Chartham054.995,-1.432",South Shields,South Shields,South Shields,Tyne and Wear,NE33 1BN
True,,17,Rising Sun Country Park Edges,Public Park,wild,mixed-forage,55.015,-1.528,"Parkland boundary trails with wild fruit, elderflowers, and autumn berries.","Parkland boundary trails with wild fruit, elderflowers, and autumn berries.",,https://images.unsplash.com/photo-1560493676-04071c5f467b?w=512&q=80,,,,,,,8;9;10,,"https://images.unsplash.com/photo-1560493676-04071c5f467b?w=512&q=80,,,,,,,8;9;10,,https://www.google.com/maps/search/?api=1&query=No+Man's+Community+Orchard,Chartham055.015,-1.528",Benton,Benton,Benton,Tyne and Wear,NE12 9SS
True,,18,Incredible Edible Wallsend,Urban Foraging,vegetables,street-planters,54.992,-1.535,Public planters in the town center and at Richardson Dees Park with herbs.,Public planters in the town center and at Richardson Dees Park with herbs.,,https://images.unsplash.com/photo-1560493676-04071c5f467b?w=512&q=80,,,,,,,8;9;10,,"https://images.unsplash.com/photo-1560493676-04071c5f467b?w=512&q=80,,,,,,,8;9;10,,https://www.google.com/maps/search/?api=1&query=No+Man's+Community+Orchard,Chartham054.992,-1.535",Wallsend,Wallsend,Wallsend,Tyne and Wear,NE28 7AD
True,,19,Washington Community Orchard,Community Orchard,fruits,tree-fruits,54.902,-1.515,Located at Princess Anne Park. Features local fruit varieties for public be...,Located at Princess Anne Park. Features local fruit varieties for public benefit.,,https://images.unsplash.com/photo-1560493676-04071c5f467b?w=512&q=80,,,,,,,8;9;10,,"https://images.unsplash.com/photo-1560493676-04071c5f467b?w=512&q=80,,,,,,,8;9;10,,https://www.google.com/maps/search/?api=1&query=No+Man's+Community+Orchard,Chartham054.902,-1.515",Washington,Washington,Washington,Tyne and Wear,NE38 7EY
True,,20,Thornley Woodlands Foraging,Woodland,wild,woodland,54.928,-1.742,Ancient woodland paths offering wild garlic and seasonal nuts.,Ancient woodland paths offering wild garlic and seasonal nuts.,,https://images.unsplash.com/photo-1560493676-04071c5f467b?w=512&q=80,,,,,,,8;9;10,,"https://images.unsplash.com/photo-1560493676-04071c5f467b?w=512&q=80,,,,,,,8;9;10,,https://www.google.com/maps/search/?api=1&query=No+Man's+Community+Orchard,Chartham054.928,-1.742",Gateshead,Gateshead,Gateshead,Tyne and Wear,NE39 1AU
True,,21,Houghton-le-Spring Orchard,Community Orchard,fruits,tree-fruits,54.845,-1.472,Small village orchard project preserving local fruit varieties.,Small village orchard project preserving local fruit varieties.,,https://images.unsplash.com/photo-1560493676-04071c5f467b?w=512&q=80,,,,,,,8;9;10,,"https://images.unsplash.com/photo-1560493676-04071c5f467b?w=512&q=80,,,,,,,8;9;10,,https://www.google.com/maps/search/?api=1&query=No+Man's+Community+Orchard,Chartham054.845,-1.472",Houghton-le-Spring,Houghton-le-Spring,Houghton-le-Spring,Tyne and Wear,DH4 4AS
True,,22,Incredible Edible Whitley Bay,Urban Foraging,vegetables,street-planters,55.042,-1.448,Community planters with free herbs and salads near the library.,Community planters with free herbs and salads near the library.,,https://images.unsplash.com/photo-1560493676-04071c5f467b?w=512&q=80,,,,,,,8;9;10,,"https://images.unsplash.com/photo-1560493676-04071c5f467b?w=512&q=80,,,,,,,8;9;10,,https://www.google.com/maps/search/?api=1&query=No+Man's+Community+Orchard,Chartham055.042,-1.448",Whitley Bay,Whitley Bay,Whitley Bay,Tyne and Wear,NE26 2QT
True,,23,Leazes Park Orchard,Community Orchard,fruits,tree-fruits,54.978,-1.622,Historic urban park orchard with northern heritage fruit varieties.,Historic urban park orchard with northern heritage fruit varieties.,,https://images.unsplash.com/photo-1560493676-04071c5f467b?w=512&q=80,,,,,,,8;9;10,,"https://images.unsplash.com/photo-1560493676-04071c5f467b?w=512&q=80,,,,,,,8;9;10,,https://www.google.com/maps/search/?api=1&query=No+Man's+Community+Orchard,Chartham054.978,-1.622",Newcastle,Newcastle,Newcastle,Tyne and Wear,NE2 4BJ
True,,24,Marsden Coastal Path,Coastal Foraging,wild,coastal,54.965,-1.385,"Coastal cliffs offering rock samphire, sea beet, and wild radish.","Coastal cliffs offering rock samphire, sea beet, and wild radish.",,https://images.unsplash.com/photo-1560493676-04071c5f467b?w=512&q=80,,,,,,,8;9;10,,"https://images.unsplash.com/photo-1560493676-04071c5f467b?w=512&q=80,,,,,,,8;9;10,,https://www.google.com/maps/search/?api=1&query=No+Man's+Community+Orchard,Chartham054.965,-1.385",South Shields,South Shields,South Shields,Tyne and Wear,NE34 7SZ
True,,25,Derwent Walk (Swalwell Section),Public Footpath,wild,hedgerow,54.952,-1.685,Disused railway trail with abundant brambles and elderberries.,Disused railway trail with abundant brambles and elderberries.,,https://images.unsplash.com/photo-1560493676-04071c5f467b?w=512&q=80,,,,,,,8;9;10,,"https://images.unsplash.com/photo-1560493676-04071c5f467b?w=512&q=80,,,,,,,8;9;10,,https://www.google.com/maps/search/?api=1&query=No+Man's+Community+Orchard,Chartham054.952,-1.685",Swalwell,Swalwell,Swalwell,Tyne and Wear,NE16 3BT
True,,26,Hetton Community Orchard,Community Orchard,fruits,tree-fruits,54.818,-1.445,Small orchard space for local residents to harvest fruit.,Small orchard space for local residents to harvest fruit.,,https://images.unsplash.com/photo-1560493676-04071c5f467b?w=512&q=80,,,,,,,8;9;10,,"https://images.unsplash.com/photo-1560493676-04071c5f467b?w=512&q=80,,,,,,,8;9;10,,https://www.google.com/maps/search/?api=1&query=No+Man's+Community+Orchard,Chartham054.818,-1.445",Hetton-le-Hole,Hetton-le-Hole,Hetton-le-Hole,Tyne and Wear,DH5 9NE
True,,27,Incredible Edible Tynemouth,Urban Foraging,vegetables,street-planters,55.018,-1.425,Public planters in the village center and station with herbs and salads.,Public planters in the village center and station with herbs and salads.,,https://images.unsplash.com/photo-1560493676-04071c5f467b?w=512&q=80,,,,,,,8;9;10,,"https://images.unsplash.com/photo-1560493676-04071c5f467b?w=512&q=80,,,,,,,8;9;10,,https://www.google.com/maps/search/?api=1&query=No+Man's+Community+Orchard,Chartham055.018,-1.425",Tynemouth,Tynemouth,Tynemouth,Tyne and Wear,NE30 4BX
True,,28,Exhibition Park Edges,Public Park,wild,mixed-forage,54.985,-1.615,Parkland boundary trails with wild fruit and seasonal berries.,Parkland boundary trails with wild fruit and seasonal berries.,,https://images.unsplash.com/photo-1560493676-04071c5f467b?w=512&q=80,,,,,,,8;9;10,,"https://images.unsplash.com/photo-1560493676-04071c5f467b?w=512&q=80,,,,,,,8;9;10,,https://www.google.com/maps/search/?api=1&query=No+Man's+Community+Orchard,Chartham054.985,-1.615",Newcastle,Newcastle,Newcastle,Tyne and Wear,NE2 4PZ
True,,29,Longbenton Community Orchard,Community Orchard,fruits,tree-fruits,55.012,-1.585,Urban orchard space managed for local fruit picking.,Urban orchard space managed for local fruit picking.,,https://images.unsplash.com/photo-1560493676-04071c5f467b?w=512&q=80,,,,,,,8;9;10,,"https://images.unsplash.com/photo-1560493676-04071c5f467b?w=512&q=80,,,,,,,8;9;10,,https://www.google.com/maps/search/?api=1&query=No+Man's+Community+Orchard,Chartham055.012,-1.585",Newcastle,Newcastle,Newcastle,Tyne and Wear,NE12 8SQ
True,,30,Incredible Edible Rowlands Gill,Urban Foraging,vegetables,street-planters,54.912,-1.745,Village planters with free-to-pick herbs and vegetables.,Village planters with free-to-pick herbs and vegetables.,,https://images.unsplash.com/photo-1560493676-04071c5f467b?w=512&q=80,,,,,,,8;9;10,,"https://images.unsplash.com/photo-1560493676-04071c5f467b?w=512&q=80,,,,,,,8;9;10,,https://www.google.com/maps/search/?api=1&query=No+Man's+Community+Orchard,Chartham054.912,-1.745",Rowlands Gill,Rowlands Gill,Rowlands Gill,Tyne and Wear,NE39 1PS
True,,31,Watergate Forest Park Edges,Public Park,wild,woodland,54.935,-1.655,Woodland trails with abundant elderberries and blackberries.,Woodland trails with abundant elderberries and blackberries.,,https://images.unsplash.com/photo-1560493676-04071c5f467b?w=512&q=80,,,,,,,8;9;10,,"https://images.unsplash.com/photo-1560493676-04071c5f467b?w=512&q=80,,,,,,,8;9;10,,https://www.google.com/maps/search/?api=1&query=No+Man's+Community+Orchard,Chartham054.935,-1.655",Gateshead,Gateshead,Gateshead,Tyne and Wear,NE11 9RQ
True,,32,Whickham Community Orchard,Community Orchard,fruits,tree-fruits,54.945,-1.685,Managed village orchard focused on northern heritage fruit.,Managed village orchard focused on northern heritage fruit.,,https://images.unsplash.com/photo-1560493676-04071c5f467b?w=512&q=80,,,,,,,8;9;10,,"https://images.unsplash.com/photo-1560493676-04071c5f467b?w=512&q=80,,,,,,,8;9;10,,https://www.google.com/maps/search/?api=1&query=No+Man's+Community+Orchard,Chartham054.945,-1.685",Whickham,Whickham,Whickham,Tyne and Wear,NE16 4DU
True,,33,Incredible Edible Blaydon,Urban Foraging,vegetables,street-planters,54.965,-1.715,Public planters in the town center with free edible plants.,Public planters in the town center with free edible plants.,,https://images.unsplash.com/photo-1560493676-04071c5f467b?w=512&q=80,,,,,,,8;9;10,,"https://images.unsplash.com/photo-1560493676-04071c5f467b?w=512&q=80,,,,,,,8;9;10,,https://www.google.com/maps/search/?api=1&query=No+Man's+Community+Orchard,Chartham054.965,-1.715",Blaydon,Blaydon,Blaydon,Tyne and Wear,NE21 5BT
True,,34,Silksworth Sports Complex Edges,Public Park,wild,mixed-forage,54.878,-1.415,Boundary paths with wild fruit and autumn berries.,Boundary paths with wild fruit and autumn berries.,,https://images.unsplash.com/photo-1560493676-04071c5f467b?w=512&q=80,,,,,,,8;9;10,,"https://images.unsplash.com/photo-1560493676-04071c5f467b?w=512&q=80,,,,,,,8;9;10,,https://www.google.com/maps/search/?api=1&query=No+Man's+Community+Orchard,Chartham054.878,-1.415",Sunderland,Sunderland,Sunderland,Tyne and Wear,SR3 1PD
True,,35,Incredible Edible Ryhope,Urban Foraging,vegetables,street-planters,54.868,-1.365,Community planters with free herbs and seasonal vegetables.,Community planters with free herbs and seasonal vegetables.,,https://images.unsplash.com/photo-1560493676-04071c5f467b?w=512&q=80,,,,,,,8;9;10,,"https://images.unsplash.com/photo-1560493676-04071c5f467b?w=512&q=80,,,,,,,8;9;10,,https://www.google.com/maps/search/?api=1&query=No+Man's+Community+Orchard,Chartham054.868,-1.365",Sunderland,Sunderland,Sunderland,Tyne and Wear,SR2 0NR
True,,36,Bents Park Edges,Public Park,wild,hedgerow,54.992,-1.415,Parkland boundary paths with elderberries and blackberries.,Parkland boundary paths with elderberries and blackberries.,,https://images.unsplash.com/photo-1560493676-04071c5f467b?w=512&q=80,,,,,,,8;9;10,,"https://images.unsplash.com/photo-1560493676-04071c5f467b?w=512&q=80,,,,,,,8;9;10,,https://www.google.com/maps/search/?api=1&query=No+Man's+Community+Orchard,Chartham054.992,-1.415",South Shields,South Shields,South Shields,Tyne and Wear,NE33 2LD
True,,37,Shiney Row Community Orchard,Community Orchard,fruits,tree-fruits,54.872,-1.498,Small village orchard project for public benefit.,Small village orchard project for public benefit.,,https://images.unsplash.com/photo-1560493676-04071c5f467b?w=512&q=80,,,,,,,8;9;10,,"https://images.unsplash.com/photo-1560493676-04071c5f467b?w=512&q=80,,,,,,,8;9;10,,https://www.google.com/maps/search/?api=1&query=No+Man's+Community+Orchard,Chartham054.872,-1.498",Houghton-le-Spring,Houghton-le-Spring,Houghton-le-Spring,Tyne and Wear,DH4 7QU
True,,38,Incredible Edible Cullercoats,Urban Foraging,vegetables,street-planters,55.035,-1.432,Planters near the seafront with free herbs and seasonal greens.,Planters near the seafront with free herbs and seasonal greens.,,https://images.unsplash.com/photo-1560493676-04071c5f467b?w=512&q=80,,,,,,,8;9;10,,"https://images.unsplash.com/photo-1560493676-04071c5f467b?w=512&q=80,,,,,,,8;9;10,,https://www.google.com/maps/search/?api=1&query=No+Man's+Community+Orchard,Chartham055.035,-1.432",Cullercoats,Cullercoats,Cullercoats,Tyne and Wear,NE30 4PQ
True,,39,Team Valley Riverside Path,Public Footpath,wild,river-forage,54.935,-1.615,River Team banks with wild garlic and blackberries.,River Team banks with wild garlic and blackberries.,,https://images.unsplash.com/photo-1560493676-04071c5f467b?w=512&q=80,,,,,,,8;9;10,,"https://images.unsplash.com/photo-1560493676-04071c5f467b?w=512&q=80,,,,,,,8;9;10,,https://www.google.com/maps/search/?api=1&query=No+Man's+Community+Orchard,Chartham054.935,-1.615",Gateshead,Gateshead,Gateshead,Tyne and Wear,NE11 0QE
True,,40,Incredible Edible Boldon,Urban Foraging,vegetables,street-planters,54.945,-1.445,Village planters with herbs and salads near the metro station.,Village planters with herbs and salads near the metro station.,,https://images.unsplash.com/photo-1560493676-04071c5f467b?w=512&q=80,,,,,,,8;9;10,,"https://images.unsplash.com/photo-1560493676-04071c5f467b?w=512&q=80,,,,,,,8;9;10,,https://www.google.com/maps/search/?api=1&query=No+Man's+Community+Orchard,Chartham054.945,-1.445",East Boldon,East Boldon,East Boldon,Tyne and Wear,NE36 0BT
True,,41,Herrington Country Park Edges,Public Park,wild,mixed-forage,54.882,-1.468,Lakeside paths with abundant berries and wild fruit trees.,Lakeside paths with abundant berries and wild fruit trees.,,https://images.unsplash.com/photo-1560493676-04071c5f467b?w=512&q=80,,,,,,,8;9;10,,"https://images.unsplash.com/photo-1560493676-04071c5f467b?w=512&q=80,,,,,,,8;9;10,,https://www.google.com/maps/search/?api=1&query=No+Man's+Community+Orchard,Chartham054.882,-1.468",Sunderland,Sunderland,Sunderland,Tyne and Wear,DH4 7EL
True,,42,Incredible Edible Cleadon,Urban Foraging,vegetables,street-planters,54.938,-1.412,Community planters at the village green with herbs and veg.,Community planters at the village green with herbs and veg.,,https://images.unsplash.com/photo-1560493676-04071c5f467b?w=512&q=80,,,,,,,8;9;10,,"https://images.unsplash.com/photo-1560493676-04071c5f467b?w=512&q=80,,,,,,,8;9;10,,https://www.google.com/maps/search/?api=1&query=No+Man's+Community+Orchard,Chartham054.938,-1.412",Cleadon,Cleadon,Cleadon,Tyne and Wear,SR6 7PG
True,,43,Bridgeside Community Orchard,Community Orchard,fruits,tree-fruits,54.962,-1.612,Urban orchard space near the Quayside for local picking.,Urban orchard space near the Quayside for local picking.,,https://images.unsplash.com/photo-1560493676-04071c5f467b?w=512&q=80,,,,,,,8;9;10,,"https://images.unsplash.com/photo-1560493676-04071c5f467b?w=512&q=80,,,,,,,8;9;10,,https://www.google.com/maps/search/?api=1&query=No+Man's+Community+Orchard,Chartham054.962,-1.612",Gateshead,Gateshead,Gateshead,Tyne and Wear,NE8 2QU
True,,44,Incredible Edible Westerhope,Urban Foraging,vegetables,street-planters,55.002,-1.695,Public planters in the village center with free edible plants.,Public planters in the village center with free edible plants.,,https://images.unsplash.com/photo-1560493676-04071c5f467b?w=512&q=80,,,,,,,8;9;10,,"https://images.unsplash.com/photo-1560493676-04071c5f467b?w=512&q=80,,,,,,,8;9;10,,https://www.google.com/maps/search/?api=1&query=No+Man's+Community+Orchard,Chartham055.002,-1.695",Newcastle,Newcastle,Newcastle,Tyne and Wear,NE5 1LX
True,,45,West Pelton Wood Foraging,Woodland,wild,woodland,54.862,-1.595,Ancient woodland paths offering hazelnuts and berries.,Ancient woodland paths offering hazelnuts and berries.,,https://images.unsplash.com/photo-1560493676-04071c5f467b?w=512&q=80,,,,,,,8;9;10,,"https://images.unsplash.com/photo-1560493676-04071c5f467b?w=512&q=80,,,,,,,8;9;10,,https://www.google.com/maps/search/?api=1&query=No+Man's+Community+Orchard,Chartham054.862,-1.595",Washington,Washington,Washington,Tyne and Wear,DH9 6SE
True,,46,Incredible Edible Fenham,Urban Foraging,vegetables,street-planters,54.985,-1.655,Planters near the library and shops with free herbs and salads.,Planters near the library and shops with free herbs and salads.,,https://images.unsplash.com/photo-1560493676-04071c5f467b?w=512&q=80,,,,,,,8;9;10,,"https://images.unsplash.com/photo-1560493676-04071c5f467b?w=512&q=80,,,,,,,8;9;10,,https://www.google.com/maps/search/?api=1&query=No+Man's+Community+Orchard,Chartham054.985,-1.655",Newcastle,Newcastle,Newcastle,Tyne and Wear,NE4 9YH
True,,47,Roker Coastal Path Foraging,Coastal Foraging,wild,coastal,54.922,-1.365,Shoreline path with sea beet and wild cabbage near the pier.,Shoreline path with sea beet and wild cabbage near the pier.,,https://images.unsplash.com/photo-1560493676-04071c5f467b?w=512&q=80,,,,,,,8;9;10,,"https://images.unsplash.com/photo-1560493676-04071c5f467b?w=512&q=80,,,,,,,8;9;10,,https://www.google.com/maps/search/?api=1&query=No+Man's+Community+Orchard,Chartham054.922,-1.365",Sunderland,Sunderland,Sunderland,Tyne and Wear,SR6 0PL
